INDEX,TIER1 JOB,TIER2 JOB,TIER3 JOB,SKILL
K0226,Education/Teaching,,,Knowledge of organizational training systems.
K0227,Systems Architecture,,,Knowledge of various types of computer architectures.
K0228,Cybersecurity Foundations,,,Knowledge of taxonomy and semantic ontology theory.
K0229,Analysis,,,"Knowledge of applications that can log errors, exceptions, and application faults and logging."
K0230,Networking,Cloud Computing,,Knowledge of cloud service models and how those models can limit incident response.
K0231,Disaster Management,,,"Knowledge of crisis management protocols, processes, and techniques."
K0233,Cybersecurity Foundations,,,"Knowledge of the National Cybersecurity Workforce Framework, work roles, and associated tasks, knowledge, skills, and abilities."
K0234,Cybersecurity Foundations,,,"Knowledge of full spectrum cyber capabilities (e.g., defense, attack, exploitation, surveillance, reporting)."
K0235,Education/Teaching,,,"Knowledge of how to leverage research and development centers, think tanks, academic research, and industry systems."
K0236,Programming Languages,,,"Knowledge of how to utilize Hadoop, Java, Python, SQL, Hive, and Pig to explore data."
K0237,IT Management/Services,,,Knowledge of industry best practices for service desk.
K0238,Data Mining,,,Knowledge of machine learning theory and principles.
K0239,Communication Architecture and Security,,,"Knowledge of media production, communication, and dissemination techniques and methods, including alternative ways to inform via written, oral, and visual media."
K0240,Data Security,,,Knowledge of multi-level security systems and cross domain solutions.
K0241,Cyber Crime and Law,,,"Knowledge of organizational human resource policies, processes, and procedures."
K0242,Cyber Crime and Law,,,Knowledge of organizational security policies.
K0243,Education/Teaching,,,"Knowledge of organizational training and education policies, processes, and procedures."
K0244,Forensics,,,Knowledge of physical and physiological behaviors that may indicate suspicious or abnormal activity.
K0245,Education/Teaching,,,Knowledge of principles and processes for conducting training and education needs assessment.
K0246,Software Development,,,"Knowledge of relevant concepts, procedures, software, equipment, and technology applications."
K0247,IT Management/Services,,,"Knowledge of remote access processes, tools, and capabilities related to customer support."
K0248,Cyber Threats,,,Knowledge of strategic theory and practice.
K0249,IT Management/Services,,,"Knowledge of sustainment technologies, processes and strategies."
K0250,Education/Teaching,,,Knowledge of Test & Evaluation processes for learners.
K0251,Cyber Crime and Law,,,"Knowledge of the judicial process, including the presentation of facts and evidence."
K0252,Education/Teaching,,,"Knowledge of training and education principles and methods for curriculum design, teaching and instruction for individuals and groups, and the measurement of training and education effects."
K0254,Analysis,,,Knowledge of binary analysis.
K0255,Communication Architecture and Security,,,"Knowledge of network architecture concepts including topology, protocols, and components."
K0257,Cyber Crime and Law,,,Knowledge of information technology (IT) acquisition/procurement requirements.
K0258,Cybersecurity Foundations,,,"Knowledge of test procedures, principles, and methodologies (e.g., Capabilities and Maturity Model Integration (CMMI), audits, penetration testing, vulnerability scanning, risk assessments)."
K0259,Analysis,,,Knowledge of malware analysis concepts and methodologies.
K0260,Data Security,,,Knowledge of Personally Identifiable Information (PII) data security standards.
K0261,Data Security,,,Knowledge of Payment Card Industry (PCI) data security standards.
K0262,Data Security,,,Knowledge of Personal Health Information (PHI) data security standards.
K0263,IT Management/Services,,,"Knowledge of information technology (IT) risk management policies, requirements, and procedures."
K0264,IT Management/Services,,,"Knowledge of program protection planning (e.g. information technology (IT) supply chain security/risk management policies, anti-tampering techniques, and requirements)."
K0265,IT Management/Services,,,"Knowledge of infrastructure supporting information technology (IT) for safety, performance, and reliability."
K0266,Forensics,,,Knowledge of how to evaluate the trustworthiness of the supplier and/or product.
K0267,Cyber Crime and Law,,,"Knowledge of laws, policies, procedures, or governance relevant to cybersecurity for critical infrastructures."
K0268,Forensics,,,Knowledge of forensic footprint identification.
K0269,Communication Architecture and Security,,,Knowledge of mobile communications architecture.
K0270,Software Development,,,Knowledge of the acquisition/procurement life cycle process.
K0271,Operating Systems,,,"Knowledge of operating system structures and internals (e.g., process management, directory structure, installed applications)."
K0272,Analysis,,,Knowledge of network analysis tools used to identify software communications vulnerabilities.
K0274,Networking,,,"Knowledge of transmission records (e.g., Bluetooth, Radio Frequency Identification (RFID), Infrared Networking (IR), Wireless Fidelity (Wi-Fi). paging, cellular, satellite dishes, Voice over Internet Protocol (VoIP)), and jamming techniques that enable transmission of undesirable information, or prevent installed systems from operating correctly."
K0275,IT Management/Services,,,Knowledge of configuration management techniques.
K0276,IT Management/Services,,,Knowledge of security management.
K0277,Encryption and Cryptography,,,"Knowledge of current and emerging data encryption (e.g., Column and Tablespace Encryption, file and disk encryption) security features in databases (e.g. built-in cryptographic key management features)."
K0278,Database Systems,,,Knowledge of current and emerging data remediation security features in databases.
K0280,Systems Architecture,Embedded Systems,,"Knowledge of systems engineering theories, concepts, and methods."
K0281,IT Management/Services,,,Knowledge of information technology (IT) service catalogues.
K0283,Cybersecurity Foundations,Cloud Computing,,"Knowledge of use cases related to collaboration and content synchronization across platforms (e.g., Mobile, PC, Cloud, Consoles)."
K0284,Data Security,,,Knowledge of developing and applying user credential management system.
K0285,Encryption and Cryptography,,,Knowledge of implementing enterprise key escrow systems to support data-at-rest encryption.
K0286,Networking,,,Knowledge of N-tiered typologies (e.g. including server and client operating systems).
K0287,Data Security,,,Knowledge of an organization's information classification program and procedures for information compromise.
K0288,Data Security,,,Knowledge of industry standard security models.
K0289,Networking,,,Knowledge of system/server diagnostic tools and fault identification techniques.
K0290,Communication Architecture and Security,,,Knowledge of systems security testing and evaluation methods.
K0291,IT Management/Services,,,"Knowledge of the enterprise information technology (IT) architectural concepts and patterns (e.g., baseline, validated design, and target architectures.)"
K0292,Disaster Management,,,"Knowledge of the operations and processes for incident, problem, and event management."
K0293,Systems Architecture,,,Knowledge of integrating the organization’s goals and objectives into the architecture.
K0294,IT Management/Services,,,"Knowledge of IT system operation, maintenance, and security needed to keep equipment functioning properly."
K0295,Cybersecurity Foundations,Privacy,,"Knowledge of confidentiality, integrity, and availability principles."
K0296,Communication Architecture and Security,,,"Knowledge of capabilities, applications, and potential vulnerabilities of network equipment including hubs, routers, switches, bridges, servers, transmission media, and related hardware."
K0297,Intrusion Detection Systems,,,Knowledge of countermeasure design for identified security risks.
K0298,Intrusion Detection Systems,,,Knowledge of countermeasures for identified security risks.
K0299,Data Security,,,"Knowledge in determining how a security system should work (including its resilience and dependability capabilities) and how changes in conditions, operations, or the environment will affect these outcomes."
K0300,Networking,,,Knowledge of network mapping and recreating network topologies.
K0301,Analysis,Networking,,"Knowledge of packet-level analysis using appropriate tools (e.g., Wireshark, tcpdump, Tproxy, NetworkMiner, Fiddler, WinDump, BruteShark, OmniPeek)."
K0302,Cybersecurity Foundations,,,Knowledge of the basic operation of computers.
K0303,Networking,,,Knowledge of the use of sub-netting tools.
K0304,Forensics,,,Knowledge of concepts and practices of processing digital forensic data.
K0305,Encryption and Cryptography,,,Knowledge of data concealment (e.g. encryption algorithms and stenography).
K0308,Encryption and Cryptography,,,Knowledge of cryptology.
K0309,Forensics,,,Knowledge of emerging technologies that have potential for exploitation.
K0310,Cyber Threats,Ethical Hacking,,Knowledge of hacking methodologies.
K0311,Analysis,,,Knowledge of industry indicators useful for identifying technology trends.
K0312,Cyber Crime and Law,,,"Knowledge of intelligence gathering principles, policies, and procedures including legal authorities and restrictions."
K0313,Education/Teaching,,,"Knowledge of external organizations and academic institutions with cyber focus (e.g., cyber curriculum/training and Research & Development)."
K0314,Cyber Threats,,,Knowledge of industry technologies’ potential cybersecurity vulnerabilities.
K0315,Data Mining,,,"Knowledge of the principal methods, procedures, and techniques of gathering information and producing, reporting, and sharing information."
K0316,Cyber Crime and Law,,,"Knowledge of business or military operation plans, concept operation plans, orders, policies, and standing rules of engagement."
K0317,Disaster Management,,,"Knowledge of procedures used for documenting and querying reported incidents, problems, and events."
K0318,Operating Systems,,,Knowledge of operating system command-line tools.
K0319,Networking,,,Knowledge of technical delivery capabilities and their limitations.
K0320,Forensics,,,Knowledge of organization's evaluation and validation criteria.
K0321,Systems Architecture,,,Knowledge of engineering concepts as applied to computer architecture and associated computer hardware/software.
K0322,Systems Architecture,Embedded Systems,,Knowledge of embedded systems.
K0323,Disaster Management,,,Knowledge of system fault tolerance methodologies.
K0324,Intrusion Detection Systems,,,Knowledge of Intrusion Detection System (IDS)/Intrusion Prevention System (IPS) tools and applications.
K0325,Cybersecurity Foundations,,,"Knowledge of Information Theory (e.g., source coding, channel coding, algorithm complexity theory, and data compression)."
K0326,Cyber Crime and Law,,,Knowledge of demilitarized zones.
K0330,Systems Architecture,,,Knowledge of successful capabilities to identify the solutions to less common and more complex system problems.
K0332,Networking,,,"Knowledge of network protocols such as TCP/IP, Dynamic Host Configuration, Domain Name System (DNS), and directory services."
K0333,Networking,,,"Knowledge of network design processes, to include understanding of security objectives, operational objectives, and trade-offs."
K0334,Analysis,,,"Knowledge of network traffic analysis (tools, methodologies, processes)."
K0335,Cybersecurity Foundations,,,Knowledge of current and emerging cyber technologies.
K0336,Data Security,,,Knowledge of access authentication methods.
K0338,Data Mining,,,Knowledge of data mining techniques.
K0339,Analysis,,,Knowledge of how to use network analysis tools to identify vulnerabilities.
K0341,Cyber Crime and Law,,,Knowledge of foreign disclosure policies and import/export control regulations as related to cybersecurity.
K0342,Cyber Threats,Ethical Hacking,,"Knowledge of penetration testing principles, tools, and techniques."
K0343,Analysis,,,Knowledge of root cause analysis techniques.
K0344,Cyber Threats,,,Knowledge of an organization’s threat environment.
K0346,Software Development,,,Knowledge of principles and methods for integrating system components.
K0347,Software Development,,,Knowledge and understanding of operational design.
K0349,Systems Architecture,Web Dev,,"Knowledge of website types, administration, functions, and content management system (CMS)."
K0350,IT Management/Services,,,Knowledge of accepted organization planning systems.
K0351,Cyber Crime and Law,,,"Knowledge of applicable statutes, laws, regulations and policies governing cyber targeting and exploitation."
K0352,Forensics,,,"Knowledge of forms of intelligence support needs, topics, and focus areas."
K0353,Data Mining,,,Knowledge of possible circumstances that would result in changing collection management authorities.
K0354,Disaster Management,,,Knowledge of relevant reporting and dissemination procedures.
K0355,Disaster Management,,,Knowledge of all-source reporting and dissemination procedures.
K0356,Analysis,,,"Knowledge of analytic tools and techniques for language, voice and/or graphic material."
K0357,Analysis,,,Knowledge of analytical constructs and their use in assessing the operational environment.
K0358,Analysis,,,Knowledge of analytical standards and the purpose of intelligence confidence levels.
K0359,Disaster Management,,,Knowledge of approved intelligence dissemination processes.
K0361,Data Mining,,,"Knowledge of asset availability, capabilities and limitations."
K0362,Cyber Threats,Ethical Hacking,,"Knowledge of attack methods and techniques (DDoS, brute force, spoofing, phishing, man-in-the-middle, sql injection, apt, zero-day exploit, etc.)."
K0363,Analysis,,,"Knowledge of auditing and logging procedures (including server-based logging, user ID, terminal ID, network access)."
K0364,Database Systems,,,Knowledge of available databases and tools necessary to assess appropriate collection tasking.
K0367,Cyber Threats,Ethical Hacking,,Knowledge of penetration testing.
K0368,Data Mining,,,Knowledge of implants that enable cyber collection and/or preparation activities.
K0371,Data Mining,,,"Knowledge of principles of the collection development processes (e.g., Dialed Number Recognition, Social Network Analysis)."
K0372,Programming Languages,,,"Knowledge of programming concepts (e.g., levels, structures, compiled vs. interpreted languages)."
K0373,Software Development,,,"Knowledge of basic software applications (e.g., data storage and backup, database applications) and the types of vulnerabilities that have been found in those applications."
K0375,Networking,Wireless Systems,,Knowledge of wireless applications vulnerabilities.
K0376,Data Mining,,,"Knowledge of internal and external customers and partner organizations, including information needs, objectives, structure, capabilities, etc."
K0377,Data Mining,,,"Knowledge of classification and control markings standards, policies and procedures."
K0379,Data Mining,,,"Knowledge of client organizations, including information needs, objectives, structure, capabilities, etc."
K0380,Cybersecurity Foundations,,,Knowledge of collaborative tools and environments.
K0381,Disaster Management,,,Knowledge of collateral damage and estimating impact(s).
K0382,Data Mining,,,Knowledge of collection capabilities and limitations.
K0383,Data Mining,,,"Knowledge of collection capabilities, accesses, performance specifications, and constraints utilized to satisfy collection plan."
K0384,Data Mining,,,"Knowledge of collection management functionality (e.g., positions, functions, responsibilities, products, reporting requirements)."
K0386,Data Mining,,,Knowledge of collection management tools.
K0387,Data Mining,,,Knowledge of collection planning process and collection plan.
K0388,Communication Architecture and Security,,,"Knowledge of collection searching/analyzing techniques and tools for chat/buddy list, emerging technologies, VOIP, Media Over IP, VPN, VSAT/wireless, web mail and cookies."
K0389,Data Mining,,,Knowledge of collection sources including conventional and non-conventional sources.
K0390,Data Mining,,,Knowledge of collection strategies.
K0391,Data Mining,,,"Knowledge of collection systems, capabilities, and processes."
K0392,Cyber Threats,,,"Knowledge of common computer/network infections (virus, Trojan, etc.) and methods of infection (ports, attachments, etc.)."
K0393,Networking,,,Knowledge of common networking devices and their configurations.
K0394,Database Systems,,,Knowledge of common reporting databases and tools.
K0395,Networking,,,"Knowledge of computer networking fundamentals (i.e., basic computer components of a network, types of networks, etc.)."
K0396,Programming Languages,,,"Knowledge of computer programming concepts, including computer languages, programming, testing, debugging, and file types."
K0397,Operating Systems,,,"Knowledge of security concepts in operating systems (e.g., Linux, Unix, Windows, iOS, Android, ChromeOS, macOS, Ubuntu)"
K0398,Systems Architecture,Web Dev,,"Knowledge of concepts related to websites (e.g., web servers/pages, hosting, DNS, registration, web languages such as HTML, Javascript, CSS)."
K0399,Disaster Management,,,Knowledge of crisis action planning and time sensitive planning procedures.
K0400,Disaster Management,,,Knowledge of crisis action planning for cyber operations.
K0401,Data Mining,,,Knowledge of criteria for evaluating collection products.
K0402,Cyber Threats,,,"Knowledge of criticality and vulnerability factors (e.g., value, recuperation, cushion, countermeasures) for target selection and applicability to the cyber domain."
K0403,Encryption and Cryptography,,,"Knowledge of cryptologic capabilities, limitations, and contributions to cyber operations."
K0404,Data Mining,,,Knowledge of current collection requirements.
K0405,Intrusion Detection Systems,,,Knowledge of current computer-based intrusion sets.
K0406,Intrusion Detection Systems,,,Knowledge of current software and methodologies for active defense and system hardening.
K0407,Data Mining,,,Knowledge of customer information needs.
K0408,Cybersecurity Foundations,,,"Knowledge of cyber actions (i.e. cyber defense, information gathering, environment preparation, cyber-attack) principles, capabilities, limitations, and effects."
K0409,Data Mining,,,Knowledge of cyber intelligence/information collection capabilities and repositories.
K0410,Cyber Crime and Law,,,Knowledge of cyber laws and their effect on Cyber planning.
K0411,Cyber Crime and Law,,,Knowledge of cyber laws and legal considerations and their effect on cyber planning.
K0412,Cybersecurity Foundations,,,Knowledge of cyber lexicon/terminology
K0413,Cyber Crime and Law,,,"Knowledge of cyber operation objectives, policies, and legalities."
K0414,Cybersecurity Foundations,,,Knowledge of cyber operations support or enabling processes.
K0415,Cybersecurity Foundations,,,Knowledge of cyber operations terminology/lexicon.
K0416,Cybersecurity Foundations,,,Knowledge of cyber operations.
K0417,Communication Architecture and Security,,,"Knowledge of data communications terminology (e.g., networking protocols, Ethernet, IP, encryption, optical devices, removable media)."
K0418,Data Mining,,,Knowledge of data flow process for terminal or environment collection.
K0419,Database Systems,,,Knowledge of database administration and maintenance.
K0420,Database Systems,,,Knowledge of database theory.
K0421,Database Systems,,,"Knowledge of databases, portals and associated dissemination vehicles."
K0422,Cyber Threats,,,Knowledge of deconfliction processes and procedures.
K0423,Disaster Management,,,Knowledge of deconfliction reporting to include external organization interaction.
K0424,Cyber Threats,,,Knowledge of denial and deception techniques.
K0425,Cybersecurity Foundations,,,"Knowledge of different organization objectives at all levels, including subordinate, lateral and higher."
K0426,Cybersecurity Foundations,,,Knowledge of dynamic and deliberate targeting.
K0427,Encryption and Cryptography,,,"Knowledge of encryption algorithms and cyber capabilities/tools (e.g., SSL, PGP, Triple DES, AES, RSA, Blowfish, Twofish)."
K0428,Encryption and Cryptography,,,Knowledge of encryption algorithms and tools for wireless local area networks (WLANs).
K0429,IT Management/Services,,,Knowledge of enterprise-wide information management.
K0430,Cyber Threats,,,Knowledge of evasion strategies and techniques.
K0431,Communication Architecture and Security,,,Knowledge of evolving/emerging communications technologies.
K0432,Cyber Threats,,,"Knowledge of existing, emerging, and long-range issues related to cyber operations strategy, policy, and organization."
K0433,Forensics,,,Knowledge of forensic implications of operating system structure and operations.
K0435,Cybersecurity Foundations,,,"Knowledge of fundamental cyber concepts, principles, limitations, and effects."
K0436,Cybersecurity Foundations,,,"Knowledge of fundamental cyber operations concepts, terminology/lexicon (i.e., environment preparation, cyber-attack, cyber defense), principles, capabilities, limitations, and effects."
K0437,Programming Languages,,,Knowledge of general Supervisory control and data acquisition (SCADA) system components.
K0438,Communication Architecture and Security,,,"Knowledge of mobile cellular communications architecture (e.g., LTE, CDMA, GSM/EDGE and UMTS/HSPA)."
K0439,Cyber Crime and Law,,,Knowledge of governing authorities for targeting.
K0440,Cyber Threats,,,Knowledge of host-based security products and how those products affect exploitation and reduce vulnerability.
K0442,Cybersecurity Foundations,,,"Knowledge of how converged technologies impact cyber operations (e.g., digital, telephony, wireless, wired)."
K0443,Networking,,,"Knowledge of how hubs, switches, routers work together in the design of a network."
K0444,Communication Architecture and Security,,,"Knowledge of how Internet applications work (SMTP email, web-based email, chat clients, VOIP)."
K0445,Communication Architecture and Security,,,Knowledge of how modern digital and telephony networks impact cyber operations.
K0446,Communication Architecture and Security,Wireless Systems,,Knowledge of how modern wireless communications systems impact cyber operations.
K0447,Communication Architecture and Security,,,"Knowledge of how to collect, view, and identify essential information on targets of interest from metadata (e.g., email, http, PII, cookies)."
K0448,Data Mining,,,Knowledge of how to establish priorities for resources.
K0449,Data Mining,,,"Knowledge of how to extract, analyze, and use metadata."
K0451,IT Management/Services,,,Knowledge of identification and reporting processes.
K0452,Operating Systems,,,"Knowledge of implementing Unix and Windows systems that provide radius authentication and logging, DNS, mail, web service, FTP server, DHCP, firewall, and SNMP."
K0453,Forensics,,,Knowledge of indications and warning.
K0454,Data Mining,,,Knowledge of information needs.
K0455,Data Security,,,"Knowledge of information security concepts, facilitating technologies and methods."
K0456,Forensics,,,Knowledge of intelligence capabilities and limitations.
K0457,Data Security,,,Knowledge of intelligence confidence levels.
K0458,Forensics,,,Knowledge of intelligence disciplines.
K0459,Cyber Crime and Law,,,"Knowledge of intelligence employment requirements (i.e., logistical, communications support, maneuverability, legal restrictions, etc.)."
K0460,Forensics,,,Knowledge of intelligence preparation of the environment and similar processes.
K0461,Forensics,,,Knowledge of intelligence production processes.
K0462,Data Mining,,,"Knowledge of intelligence reporting principles, policies, procedures, and vehicles, including report formats, reportability criteria (requirements and priorities), dissemination practices, and legal authorities and restrictions."
K0463,Data Mining,,,Knowledge of intelligence requirements tasking systems.
K0464,Data Mining,,,"Knowledge of intelligence support to planning, execution, and assessment."
K0465,Cybersecurity Foundations,,,Knowledge of internal and external partner cyber operations capabilities and tools.
K0466,Forensics,,,Knowledge of internal and external partner intelligence processes and the development of information requirements and essential information.
K0467,Forensics,,,"Knowledge of internal and external partner organization capabilities and limitations (those with tasking, collection, processing, exploitation and dissemination responsibilities)."
K0468,Cybersecurity Foundations,Technical Writing,,Knowledge of internal and external partner reporting.
K0469,Cyber Threats,,,Knowledge of internal tactics to anticipate and/or emulate threat capabilities and actions.
K0470,Networking,,,Knowledge of Internet and routing protocols.
K0471,Networking,,,"Knowledge of Internet network addressing (IP addresses, classless inter-domain routing, TCP/UDP port numbering)."
K0472,Intrusion Detection Systems,,,Knowledge of intrusion detection systems and signature development.
K0473,Intrusion Detection Systems,,,Knowledge of intrusion sets.
K0474,Cyber Threats,,,Knowledge of key cyber threat actors and their equities.
K0475,Cyber Threats,,,Knowledge of key factors of the operational environment and threat.
K0476,Cybersecurity Foundations,,,Knowledge of language processing tools and techniques.
K0477,IT Management/Services,,,Knowledge of leadership's Intent and objectives.
K0478,Cyber Crime and Law,,,Knowledge of legal considerations in targeting.
K0479,Analysis,,,Knowledge of malware analysis and characteristics.
K0480,Cyber Threats,,,Knowledge of malware.
